<?xml version="1.0" encoding="UTF-8"?>
<eduverse xmlns:xsi="http://www.w3.org/2001/XMLSchema-instance"
          xsi:noNamespaceSchemaLocation="courses.xsd">

    <courses>
        <course id="C001">
            <title>Full-Stack Web Development</title>
            <category>Web Development</category>
            <instructor>
                <name>Dr. Aanya Sharma</name>
                <designation>Software Engineer</designation>
            </instructor>
            <description>A basic course on building web applications using HTML, CSS, and JavaScript.</description>
            <duration>18 Weeks</duration>
            <lectures>120</lectures>
            <level>Beginner to Advanced</level>
            <language>English</language>
            <price currency="INR">4999</price>
            <originalPrice currency="INR">9999</originalPrice>
            <rating>4.9</rating>
            <reviews>2300</reviews>
            <certificate>true</certificate>
        </course>

        <course id="C002">
            <title>Data Science and Machine Learning</title>
            <category>Data Science</category>
            <instructor>
                <name>Prof. Rajesh Kumar</name>
                <designation>Data Science Instructor</designation>
            </instructor>
            <description>A basic course on data analysis, statistics, and machine learning concepts.</description>
            <duration>20 Weeks</duration>
            <lectures>150</lectures>
            <level>Intermediate</level>
            <language>English</language>
            <price currency="INR">5499</price>
            <originalPrice currency="INR">10999</originalPrice>
            <rating>4.8</rating>
            <reviews>1800</reviews>
            <certificate>true</certificate>
        </course>

        <course id="C003">
            <title>AWS Cloud Practitioner</title>
            <category>Cloud Computing</category>
            <instructor>
                <name>Anjali Gupta</name>
                <designation>Cloud Instructor</designation>
            </instructor>
            <description>A basic course on cloud computing concepts and AWS services.</description>
            <duration>12 Weeks</duration>
            <lectures>90</lectures>
            <level>Beginner</level>
            <language>English</language>
            <price currency="INR">3999</price>
            <originalPrice currency="INR">7999</originalPrice>
            <rating>4.7</rating>
            <reviews>1200</reviews>
            <certificate>true</certificate>
        </course>

        <course id="C004">
            <title>UI/UX Design Masterclass</title>
            <category>UI/UX Design</category>
            <instructor>
                <name>Kavita Reddy</name>
                <designation>Design Instructor</designation>
            </instructor>
            <description>A basic course on user interface and user experience design principles.</description>
            <duration>14 Weeks</duration>
            <lectures>100</lectures>
            <level>Beginner to Intermediate</level>
            <language>English</language>
            <price currency="INR">4499</price>
            <originalPrice currency="INR">8999</originalPrice>
            <rating>4.8</rating>
            <reviews>950</reviews>
            <certificate>true</certificate>
        </course>

        <course id="C005">
            <title>React Native App Development</title>
            <category>Mobile Development</category>
            <instructor>
                <name>Vikram Singh</name>
                <designation>Mobile Development Instructor</designation>
            </instructor>
            <description>A basic course on building mobile apps using React Native.</description>
            <duration>16 Weeks</duration>
            <lectures>110</lectures>
            <level>Intermediate</level>
            <language>English</language>
            <price currency="INR">4299</price>
            <originalPrice currency="INR">8599</originalPrice>
            <rating>4.6</rating>
            <reviews>780</reviews>
            <certificate>true</certificate>
        </course>

        <course id="C006">
            <title>Ethical Hacking and Cybersecurity</title>
            <category>Cybersecurity</category>
            <instructor>
                <name>Dr. Suresh Verma</name>
                <designation>Cybersecurity Instructor</designation>
            </instructor>
            <description>A basic course on cybersecurity concepts and ethical hacking techniques.</description>
            <duration>20 Weeks</duration>
            <lectures>140</lectures>
            <level>Intermediate to Advanced</level>
            <language>English</language>
            <price currency="INR">5999</price>
            <originalPrice currency="INR">11999</originalPrice>
            <rating>4.9</rating>
            <reviews>1500</reviews>
            <certificate>true</certificate>
        </course>
    </courses>

    <contactInfo>
        <address>123 Learning Street, Koramangala, Bangalore, Karnataka, India - 560034</address>
        <email>info@eduverse.com</email>
        <phone>+91 98765 43210</phone>
        <website>https://www.eduverse.com</website>
    </contactInfo>

</eduverse>
